created_at,text,sentiment_score
2022-11-28T20:02:11.000Z,The Ending of ‘Glass Onion: A Knives Out Mystery’ Brutally Mocks Elon Musk-Type CEOs https://t.co/bpFbfhaHlw,1.047
2022-11-28T20:01:50.000Z,Daniel Craig showing up in Glass Onion is among the most excited I’ve seen an audience get this year. People love that guy. This is such a perfect post-Bond for him,9.454
2022-11-28T20:02:41.000Z,"nope, eeaao, the woman king, glass onion, the batman, pearl, bp wakanda forever, the menu... this year in movies has been so much fun",7.771
2022-11-28T20:03:27.000Z,"Are you looking for a casual, sport fitting, fashion style women wear at an affordable friendly rate? 
Check out Sollarmint Stores, they give you all your wears at an affordable price with a 15% off the shipping of your first order with the code WELCOME15
https://t.co/hFHD5UVYKy https://t.co/aVH87vgxMo",8.243
2022-11-28T20:03:00.000Z,man knives out: glass onion is so extremely fun,7.978
2022-11-28T20:03:55.000Z,@akirakibo it wont be on next sunday its only 1 week limited theatre release :(((((,4.2345
2022-11-28T20:04:18.000Z,"@favouritefi I want to dress like him, I want to be him, I love him",9.037
2022-11-28T20:04:34.000Z,"@scottEmovienerd I'm guessing when the date was confirmed they were considering a larger release, and then corporate bureaucracy prevented either date from moving. (I hold out a conspiratorial sliver of hope they'll increase the run after its present success.)",9.201
2022-11-28T20:04:09.000Z,"Also, Janelle Monáe is awesome, but that was true before this",8.6955
2022-11-28T20:06:33.000Z,So THIS is why I didn't like the menu https://t.co/5mhdKxmhT2,3.6225
2022-11-28T20:05:57.000Z,"@cutpriceguignol Damn, that's a shame. I'll almost certainly still watch it though.",1.213
2022-11-28T20:05:24.000Z,@scottEmovienerd Knives Out was my all time favorite but Glass Onion was even better. Hopefully after the third Netflix gives up rights,9.2775
2022-11-28T20:07:46.000Z,"@beastobsessed Just saw this yesterday and thought it was awful. Characters were flat, Daniel Craig dominated everything, first half hour was giant non sequitur. Train wreck. How's it doing on rotten tomatoes? 93%...figures.",0.7595
2022-11-28T20:07:53.000Z,Same. I own a wonderful steelbook of the original and I'd love to be able to but a similar version of this one @netflix https://t.co/ww22is8KZ5,8.404
2022-11-28T20:07:52.000Z,"RT @MarienneMaid: So help me if Netflix doesn’t have extras for Glass Onion, specifically the wardrobe department 😤😤😤",7.288
2022-11-28T20:08:45.000Z,@KnivesOut ok not bad,8.0935
2022-11-28T20:10:10.000Z,Glass Onion is so goddamn fun. They need to make a million of these movies,4.47
2022-11-28T20:10:06.000Z,"It's 8pm, leaving the house for Glass Onion, so that I can squeeze in two other films tomorrow😂 영화니까 이렇게 한다 nothing else will ever make me get out of my warm house on a winter night",6.1315
2022-11-28T20:11:15.000Z,dk bout you but i loved glass onion,8.7345
2022-11-28T20:11:44.000Z,@glassdurden WHERE ARE YOU WATCHING THIS PLEASE I CAN’T WAIT EITHER,6.9345
2022-11-28T20:12:42.000Z,Glass Onion was an absolute treat that deserves far more than a one-week run in theaters. Watching how both its timely themes and structure evolved and intersected over the course of 2.5 hours made for one of the most engaging experiences I’ve had watching a movie this year.,8.295
2022-11-28T20:13:53.000Z,"RT @FriendBreakfast: is glass onion good? like, is it tasty? i mean as a movie, can i eat it? will it hurt me to eat the movie glass onion?…",6.25
2022-11-28T20:14:32.000Z,oh my god glass onion was amazing!! i loved it!! the cast was phenomenal i can’t wait to watch it again!!,9.3445
2022-11-28T20:15:04.000Z,"@phisnom @CPBits yeah, knives out is really good funny murder-mystery film. i have watched this film like a million times. i haven't got the time watching Glass Onion, but I WILL WATCH IT!",8.371
2022-11-28T20:15:04.000Z,"i went to the cinema again to watch glass onion for the second time and i loved it even more, i’m obsessed https://t.co/y4gooHoViA",7.2225
2022-11-28T20:18:08.000Z,oh this is a fucking masterpiece this is the new godfather the new joker oh my god https://t.co/ktN9ySh4so,8.951
2022-11-28T20:18:14.000Z,Counterpoint: Rian Johnson desperately wants someone to tell him he can say “faggot” but he cannot (agree with the part about Jane tho) https://t.co/IgBvbpBogz,1.3385
2022-11-28T20:15:13.000Z,i wanna see glass onion so bad but alas! exams.,1.5025
2022-11-28T20:18:47.000Z,"Ok now that it's been out for viewing...I legiti didn't think Rian Johnson could top ""What did the Nazi boy overhear while masturbating in the bathroom"" as a line, but goddamn did that Benoit monologue while revealing the killer in Glass Onion go above and beyond.",0.6105
2022-11-28T20:19:18.000Z,limited releases make me so pressed like what do u mean i would’ve needed to cross state lines to see vesper and something in the dirt and i only get to watch glass onion in theaters once before it’s gone forever,4.3325
2022-11-28T20:19:24.000Z,"Sad to say I'm kind of on the disappointed side of Glass Onion's reception. Very much enjoyed myself, the cast are great, but whew it's heavily flawed. A regression in a few ways compared to KO 1. I really don't get all the 5 stars on LB but, power to you all anyhow",6.949
2022-11-28T20:19:41.000Z,@AFilmAddicted @rianjohnson It wasn’t just inspired by it was a costume complete with the hairstyle!,3.0625
2022-11-28T20:21:34.000Z,Worst part of Glass Onion is that the Ethan Hawke device was obviously a bike lock.,1.8755
2022-11-28T20:23:32.000Z,"Glass Onion was AMAZING! Thrilling, engaging story and perfect pacing. The acting was top tier and the direction/set design/costume design were all incredible. Great work @rianjohnson and team!",9.789
2022-11-28T20:22:55.000Z,RT @mrdefoster: Glass Onion is easily one of my favorite movies of 2022.,8.454
2022-11-28T20:21:52.000Z,"wouldn't be surprised if its like a Swiss-Alps/wintertime set, makes sense given the variation Johnson seems to be going for https://t.co/ECYxXQaMGG",6.0525
2022-11-28T20:23:13.000Z,"RT @scottEmovienerd: clearly I'm not smarter than Netflix's entire marketing department, but here's what I don't get: if you're releasing G…",5.142
2022-11-28T20:25:48.000Z,"@DiscussingFilm when theyre all waiting to get on the yacht, doesnt birdie make a comment about benoit being the detective for a murder including a ballerina? that would be interesting to see for sure",4.1105
2022-11-28T20:25:09.000Z,"Funny to see Film Twitter simultaneously bemoan:

— STRANGE WORLD’s weak Thanksgiving box office
— FABLEMAN’s “flop” opening
— GLASS ONION’s extremely limited theatrical release (since it made $$$)

GLASS ONION ate Disney &amp; Spielberg’s lunch &amp; it’s BECAUSE of that limited release",1.18
2022-11-28T20:27:11.000Z,Ok so it's Glass Onion but instead of Daniel Craig's very tiring character disaster it's Austin Powers,1.23
2022-11-28T20:28:15.000Z,@adlow76 I was excited to see Glass Onion over the weekend! Also want to see the Fabelmans but it isn’t at my local theater,6.072
2022-11-28T20:28:45.000Z,HOLY SHIT! Glass Onion is so good and funny and smart and FUCK!,6.811
2022-11-28T20:29:54.000Z,"I’ll do another full review since I did one last night: this movie has a slow first 30-45 minutes, I can’t even lie. Maybe that was me waiting for it to live up to the first knives out tho. There’s literally an among us joke in the first 10 minutes that actually ends up being",4.614
2022-11-28T20:29:45.000Z,RT @Goodstyle42: It's so insane how timely Glass Onion ended up being.,2.295
2022-11-28T20:30:20.000Z,@gemko Should I be depressed that GLASS ONION was the first film I saw at a commercial multiplex with a packed audience in nearly 3 years?,2.706
2022-11-28T20:30:16.000Z,"@RonnieSerp @paladin991973 @IGN It references it, but does it ever say it?

Does it ever get an exact number of how low the scores were? Or does it say the scores were low and fails to elaborate how or why?",0.8995
2022-11-28T20:30:48.000Z,"Watched THE MENU, TRIANGLE OF SADNESS and GLASS ONION which are all movies about how horrible rich people are that also makes me really want to be a rich person.",6.692
2022-11-28T20:31:32.000Z,*normal tone of voice* Jessica Henwick in Glass Onion has the Dasha Nekrasova in Succession role,6.0115
2022-11-28T20:32:46.000Z,@notquitezennor Really enjoyed this!,7.7815
2022-11-28T20:33:55.000Z,"@netflix seems like Glass Onion @KnivesOut is doing ya some good in theaters, why don't you...oh idk... EXTEND THE THEATER RELEASE 
@rianjohnson

#GlassOnion",8.1715
2022-11-28T20:33:34.000Z,@adlow76 Maybe they’re both crashing bores for audiences making a choice with their dollars?  Glass Onion made a lot more in less theaters on exactly the same weekend and it’s not a Marvel movie.,2.1895
2022-11-28T20:16:21.000Z,"Planning on streaming tonight at 6pm CT as usual BUT it will be a shorter stream! I'll be ending at 7:30 cuz me and the boy are gonna go see GLASS ONION!!

See you soon! https://t.co/bh2EaunjQX",2.1405
2022-11-28T20:16:28.000Z,@DakotaWillKnow @M0LA3 @eriktruedson @charleyonhere I liked knives out quite a bit and most of Johnson's stuff other than last Jedi. Nice guys is way more interesting and funny imo though. It's weird that Shane black doesn't make more shit. I loved kiss kiss bang bang,9.868
2022-11-28T20:17:40.000Z,"By the way, between this one, Glass Onion, Armageddon Time, She Said, and The Fabelmans there is an absolute embarrassment of riches at the cineplex right now. I'll prob do a top 10 post and I imagine they'd all probably be on it!",4.742
2022-11-28T20:16:35.000Z,"This Was the Worst Thanksgiving Weekend in Box-Office History.: Yes, Disney's animated ""Strange World"" is a bomb — but without Netflix's ""Glass Onion,"" the weekend would have been even worse https://t.co/PC4qFGfgXo | @IndieWire #Thanksgiving #Weekend #BoxOffice #History https://t.co/wpwNwWOAoN",0.95
2022-11-28T20:17:16.000Z,"@scottEmovienerd Theater chains no doubt demanded the window / limited the release. As is Netflix managed to hit the Thanksgiving rush in theaters and will reap streaming success at Christmas, not a bad deal in the scheme  of things (sounds like it’s the best they could get) https://t.co/3SUVcqvgKH",8.875
2022-11-28T20:34:22.000Z,"@wrybombeck I'm not even sure it will be in a theater here 🫤

Knives Out in cinema was like the last fun normal thing I did before Covid.",7.9555
2022-11-28T20:17:19.000Z,"Glass Onion is an absolute blast of a movie and the entire cast is giving it their all- none more than Janelle Monae, who is a captivating and dynamic actor in ways I wasn’t prepared for. Go see it in a theatre if you can.",7.581
2022-11-28T20:34:55.000Z,"#NW Looper (2012)

a little Rian Johnson blind spot. might finish his filmography before I catch Glass Onion! https://t.co/Imaq3xmIv5",3.2615
2022-11-28T20:35:21.000Z,Very much enjoyed Glass Onion so much that I had to watch Knives Out right after cause I wanted more. Rian Johnson sure knows how to make these movies - probably gonna start making these a holiday tradition.,9.1675
2022-11-28T20:35:56.000Z,@annehelen Our full theater all busted out laughing and applauded at the reveal. What a treat!,9.063
2022-11-28T20:34:52.000Z,"They are also all wonderfully crafted (Triangle is a leeeeetle too long - satire is a sharp surgical instrument, so you need to get in and out ASAP, but overall it works).",6.753
2022-11-28T20:34:52.000Z,"Mobile, NOLA, Gulfport, and Pensacola all not getting Glass Onion?!? I’m a little annoyed (a lot)",3.4015
2022-11-28T20:36:26.000Z,@jesawyer Needs an “I haven’t seen it yet” option… so compelled to click,5.7855
2022-11-28T20:36:19.000Z,@zdch Yeah I liked it better than the first too,8.9225
2022-11-28T20:36:58.000Z,"@DiscussingFilm ""KILLERS OUT : A Knives Out mystery"" where Benoit Blanc investigate a crime scene but all suspects are cosplayers in a horror movies convention",0.403
2022-11-28T20:37:17.000Z,@bigtotoro Not surprised at all.,4.1525
2022-11-28T20:37:19.000Z,"That Glass Onion was tasty as fuck. Rian, you beautiful man, you’ve done it again.",5.5135
2022-11-28T20:38:06.000Z,GLASS ONION WAS SO FUCKING GOOOOOOOOOOOOOD HOW DID RIAN OUTDO HIMSELF HOLY SHIT,2.213
2022-11-28T20:40:15.000Z,@HazelQuimpo That's so pretty!,7.7065
2022-11-28T20:40:08.000Z,"For me, I would like increased protection from gun violence. Having to figure out the escape route each time dampens the experience. Cost is also an issue, but I’ll still splurge. Spent over 100 to see Glass Onion with a sampler, snacks and drinks. https://t.co/zwnPt0QyZw",2.0365
2022-11-28T20:40:14.000Z,Just saw Glass Onion and the only thing I can say without spoiling anything is HOLY FUCKING SHIT!!! The entire film was amazing and was a perfect sequel. I may have to see it again in theaters before Wednesday. @rianjohnson is an absolute genius!!! https://t.co/MwI7CMUbhZ,7.792
2022-11-28T20:40:35.000Z,@BillBrasky2620 Don't kink shame the official Glass Onion twitter account.,6.862
2022-11-28T20:40:20.000Z,Glass Onion was way too fire,3.3
2022-11-28T20:42:56.000Z,@CEOAdam RETIRE asap. From a very loyal ape for quiete sometime now. Pls step down,7.8545
2022-11-28T20:43:01.000Z,looking at my knives out blu ray desperately hoping glass onion gets a blu ray release,5.258
2022-11-28T20:44:37.000Z,@DiscussingFilm Winter setting please ❄️❄️,6.591
2022-11-28T20:44:32.000Z,RT @JacobSHall: One thing that I find utterly fascinating about KNIVES OUT and GLASS ONION is that they’re movies so deeply entrenched in m…,7.9245
2022-11-28T20:45:46.000Z,I'm fucking frothing at the mouth holy shit that was so good God that was SO SATISFYING holy shit,7.0935
2022-11-28T20:45:37.000Z,"@gemko @vjmfilms But also, we know movie execs guess wrong about when to open stuff or how many theaters or whether it goes straight to streaming etc. all the time. It looks like they missed the demand for GLASS ONION and could have had a bona fide holiday theatrical hit if they'd let it.",5.577
2022-11-28T20:46:04.000Z,"@JacobSHall yes! this is what frustrated me about 'knives out', but i admire that it commits to the bit",8.0295
2022-11-28T20:45:50.000Z,@scottEmovienerd I believe this is because theaters requested a 3 week window between its release and when it streams.  Only seems silly now since studios are putting movies on streaming at a whim if they don’t do well in theaters.  🤷‍♂️,4.4685
2022-11-28T20:55:26.000Z,"Just seen Glass Onion: A knives out mystery, very good great fun very clever. I didn’t work it out",9.687
2022-11-28T20:50:35.000Z,RT @diannaeanderson: I also want to make it clear that you do NOT need to have seen Knives Out in order to go see Glass Onion. They are fun…,8.6755
2022-11-28T20:55:48.000Z,Glass Onion was extremely on the nose but E**n tweeting the photo with the gun on the nightstand is just hilarious lol,8.155
2022-11-28T20:56:01.000Z,"@CreedsDelight Not only is it in limited release for only a week (despite numerous reports of sold-out screenings), but it's out JUST long enough for the mystery to get spoiled long before it actually shows up on Netflix. They should have given it a Real Movie release.",4.423
2022-11-28T20:47:12.000Z,I truly cannot believe Stephen Sondheim and Angela Lansbury's last on-screen appearances were THAT scene lmfao,8.753
2022-11-28T20:48:37.000Z,@naomicalhoun Is that the murder mystery one?,1.546
2022-11-28T20:48:33.000Z,RT @GreatCheshire: I’m so glad Glass Onion got a theater release because it’s the sort of movie theaters are made for. Just an absolutely e…,7.9745
2022-11-28T20:48:10.000Z,@RunquistKarsten It didn’t even play near me. Like what the hell. My theater chose Bones &amp; All and She Said over The Fabelmans and Glass Onion…,1.8535
2022-11-28T20:48:47.000Z,@gemko @vjmfilms I'm not a streaming service movie exec but it seems to me there's not much to lose and a lot to gain by putting actually rewatchable movies like GLASS ONION in theaters first for a legitimate run.,9.471
2022-11-28T20:47:50.000Z,@karenallen Lol. I'm not spoiling anything to say Wakanda Forever and Glass Onion - the jokes were throw aways but effective.,8.8075
2022-11-28T20:49:58.000Z,‘Strange World’ To Lose $147M: Why Theatrical Best Decision For Doomed Toon – Deadline https://t.co/VrCE0kPpHw,2.2885
2022-11-28T20:49:34.000Z,"@ZaidJilani So far, Glass Onion. Unbearable Weight of Massive Talent, Everything Everywhere All At Once, Elvis, Marcel the Shell with Shoes On, Bullet Train all excellent. Haven't seen Till, The Whale, other unreleased stuff.",8.7895
2022-11-28T20:51:24.000Z,"Early prediction, but if I find Glass Onion is as good (or possibly even better) than Knives Out 2019, it is easily going to be my Favourite Movie of the year. No competition. We shall see 😁 #GlassOnion #KnivesOut",9.2865
2022-11-28T20:51:02.000Z,"@netflix @rianjohnson OMG! Please I need to this!! Glass Onion was so good, I need every behind the scenes tidbit possible! https://t.co/5SmJXXWrFt",8.61
2022-11-28T20:51:42.000Z,The joy of a cinema audience roaring with so much enjoyment that covers all other noises. I regret missing RRR on the big screen and hope eventually The Lighthouse will show it again.,8.8175
2022-11-28T20:51:41.000Z,@rgodfrey @gemko @vjmfilms Every hour spent in a movie theater is one less hour spent on a streaming service (plus there's no splits then with not only theaters but various talent as well as unions).,8.478
2022-11-28T20:52:02.000Z,@dannybouuyy Thank your for the spoiler free review imma go watch it rn,8.5015
2022-11-28T20:52:40.000Z,"@prateeek5harma @DiscussingFilm Wanna clarify the fuck you wasn’t serious, but Glass Onion as a title is amazing",8.1005
2022-11-28T20:56:11.000Z,"shoulda been wide release, crazy. this was so fun to watch with other people in reacting w u https://t.co/kvVaZz8mJq",7.147
2022-11-28T20:58:08.000Z,"I know you’re all seeing glass onion but I’m gonna watch it with my family over Christmas on streaming so could you all please be quiet about it until then? 

Thenks",7.2485
2022-11-28T20:58:24.000Z,"@scottEmovienerd Or, ya know, do a wide release of 3 weeks at the same time as Netflix, but give Netflix some bonus content like a DVD box set. Deleted/alternate scenes, bloopers, commentary. That’s where your Netflix membership benefits.",9.5545
2022-11-28T20:58:34.000Z,"Goddamn it, I’m supposed to see Glass Onion tomorrow night. https://t.co/hIp4QAYaZK",2.6165
2022-11-28T20:58:55.000Z,"GLASS ONION is extremely good,  and it's an absolute crime that it's only had one week in cinemas.",4.605
2022-11-28T21:00:28.000Z,"@toonhound @AKlay19 @davidlsims I know people who are skipping Glass Onion in theaters because they know when it’s going to  Netflix. 

Top Gun released its VOD date months into its run and it’s going to Paramount+ on December 22nd.

Long theatrical windows with uncertain at home dates are good business.",5.129
2022-11-28T21:00:51.000Z,RT @ntagonistic: glass onion is a great movie but for me its greatest joy was simply getting to see my close personal friend benoit blanc o…,9.8155
2022-11-28T20:02:12.000Z,i need to go see glass onion fuck my life. if no one comes with me im going next sunday alone,1.1415
2022-11-28T20:01:33.000Z,@jesawyer Great movie daniel is fine,8.548
2022-11-28T20:02:13.000Z,"The timing of the Glass Onion release is so perfect that this movie is almost watched as a documentary, minus all the murdering 
how did you do it @rianjohnson",5.566
2022-11-28T20:02:20.000Z,Loved Glass Onion…I also really love Clue. I have 3 different versions of it,9.3275
2022-11-28T19:57:00.000Z,RT @ERCboxoffice: The mid-range studio film with the biggest box office upside this Thanksgiving--Netflix's GLASS ONION-- was relegated to…,5
2022-11-28T19:56:40.000Z,@itlooksreal Hahahah are they on a boat in glass onion?,5
2022-11-28T20:02:04.000Z,@jesawyer He's coming off in an intentional way,5
2022-11-28T20:02:51.000Z,@futurewolfie We would if we could. 😭,5
2022-11-28T20:03:55.000Z,@TheAcademy Glass Onion,5
2022-11-28T20:04:42.000Z,"RT @FB_BMB: Although Netflix didn't report Glass Onion's numbers, you can tell how big an impact it had, because all the Thanksgiving opene…",5
2022-11-28T20:05:26.000Z,@crispinophurs can confirm you will not understand anything i say until you see it. a must see.,5
2022-11-28T20:04:59.000Z,@crispinophurs ITS IN THEATERS FOR TWO MORE DAYS AND ITS ABSOLUTELY A CINEMATIC EXPERIENCE GO WATCH IT GO GO GO,5
2022-11-28T20:05:46.000Z,@Marginal_Eyes @CurzonSoho Rowsell😁,5
2022-11-28T20:07:12.000Z,"@galpalgalaxies @metaplexmovies I think I saw a singular ad, on twitter, months ago.",5
2022-11-28T20:08:22.000Z,@MarienneMaid @ThayIsTired I HAVE THOUGHTS,5
2022-11-28T20:08:04.000Z,@devvvtheband I’m seeing it tonight too,5
2022-11-28T20:09:45.000Z,Anyone wanna see Glass Onion at a regal cinema tonight? 👀,5
2022-11-28T20:09:36.000Z,@metaplexmovies Can't wait!,5
2022-11-28T20:11:36.000Z,@RonnieSerp @paladin991973 @IGN That article is nothing but guess work and opinions. Not facts.,5
2022-11-28T20:12:46.000Z,"There is a scene in the Glass Onion that really sums up Twitter right now. More I think about it, more accurate it feels.",5
2022-11-28T20:11:46.000Z,@fivefootlambs icon behavior,5
2022-11-28T20:13:47.000Z,@mistermovies What was the Magnolia reference? I saw Glass Onion yesterday but I don't recall that moment.,5
2022-11-28T20:14:44.000Z,Down in The South. https://t.co/VSmI1plM1m,5
2022-11-28T20:19:21.000Z,RT @beforekermit: elon musk watching “glass onion: a knives out mystery” https://t.co/pAV5gm4Oxb,5
2022-11-28T20:20:58.000Z,@AlexFoux it’s daddy’s influence,5
2022-11-28T20:21:29.000Z,Glass Onion thyme 😎,5
2022-11-28T20:21:44.000Z,"@RottenTomatoes The Glass Onion (at the theater)
She Said (at the theater)",5
2022-11-28T20:23:32.000Z,"@LydiaTarReal Maestro, have you seen the new film Glass Onion?",5
2022-11-28T20:22:45.000Z,@DiscussingFilm THE MOON,5
2022-11-28T20:25:33.000Z,@NNanpei Glass Melon?,5
2022-11-28T20:24:22.000Z,@markhachman Yo have you seen Glass Onion yet??,5
2022-11-28T20:25:54.000Z,@annehelen R I G H T?,5
2022-11-28T20:24:39.000Z,The Glass Onion 👏👏👏,5
2022-11-28T20:25:15.000Z,When does glass onion hit Netflix?,5
2022-11-28T20:24:18.000Z,‘Glass Onion’ Box Office: How the ‘Knives Out’ Sequel Left Tens of Millions on the Table https://t.co/TnURWx0WTx,5
2022-11-28T20:24:53.000Z,@DiscussingFilm That is how writing works. 😂,5
2022-11-28T20:26:03.000Z,RT @blockbustedpod: the sheer timing of the commentary in Glass Onion is almost bafflingly prophetic. really one of those movies that makes…,5
2022-11-28T20:27:19.000Z,Going to watch Glass Onion today!,5
2022-11-28T20:27:34.000Z,GLASS ONION (A KNIVES OUT MYSTERY) Movie Review https://t.co/00Nw35jW1p,5
2022-11-28T20:28:24.000Z,Glass Onion was incredible i highly reccomend,5
2022-11-28T20:29:26.000Z,@kylebuchanan rules are rules.,5
2022-11-28T20:27:52.000Z,glass onion &gt;&gt;&gt; knives out 🫣🫣🫣,5
2022-11-28T20:28:09.000Z,"RT @Darren_Mooney: This week, Netflix is releasing Rian Johnson's #GlassOnion in theatres.

I wrote about ""Knives Out"" &amp; ""Glass Onion"" at @…",5
2022-11-28T20:16:09.000Z,I saw Glass Onion: A Knives Out Mystery at AMC Theatres. Check it out! https://t.co/B5T7CLyOwo,5
2022-11-28T20:31:09.000Z,Glass Onion time 🔎 https://t.co/0D3550XGEb,5
2022-11-28T20:31:21.000Z,seated for glass onion,5
2022-11-28T20:31:13.000Z,"@vjmfilms I mean, there’s been another factor influencing attendance during that period.",5
2022-11-28T20:16:12.000Z,Janell Monae had me glued watching Glass Onion,5
2022-11-28T20:32:19.000Z,I kept waiting for the rest of the title. https://t.co/jv9kRZI52l,5
2022-11-28T20:32:30.000Z,bueno get to it https://t.co/GiLBgyuWKH,5
2022-11-28T20:34:10.000Z,he should cast me https://t.co/O5Yr56vG5Y,5
2022-11-28T20:33:59.000Z,Normalize not knowing yet https://t.co/GPbQ4BQDvi,5
2022-11-28T20:17:32.000Z,@tshakw lmk what u think,5
2022-11-28T20:17:48.000Z,Nvm I am seeing it tomorrow after class,5
2022-11-28T20:17:13.000Z,@scottEmovienerd I think its cause then a lot of people would skip out on the theater run and just wait a week to watch it at home,5
2022-11-28T20:17:21.000Z,@bdgrabinski P L A N E,5
2022-11-28T20:34:27.000Z,thinking if i should watch glass onion on 🎥 recording because i literally can’t wait https://t.co/6lH9UWRzjC,5
2022-11-28T20:36:25.000Z,@KnivesOut @DaveBautista I couldn't make it and now that shall be me....,5
2022-11-28T20:36:07.000Z,i need to see glass onion omg,5
2022-11-28T20:38:33.000Z,"@LarsenOnFilm @filmspotting @chicagocritics Kate Hudson in Glass Onion
Vanessa Burghardt in Cha Cha Real Smooth
Rachel Sennott in Bodies Bodies Bodies",5
2022-11-28T20:40:00.000Z,I think M*sk's Twitter stunts were all advertising for Glass Onion.,5
2022-11-28T20:39:59.000Z,me watching the glass onion 😭 https://t.co/v7DeFUNGqK,5
2022-11-28T20:39:58.000Z,My first instinct is...,5
2022-11-28T20:42:33.000Z,Interview: Rian Johnson peels back the layers of 'Glass Onion: A Knives Out Mystery' with @ryanmcquade77  https://t.co/mDCUBA1VzG #GlassOnion,5
2022-11-28T20:43:19.000Z,@TheAcademy Glass Onion: Knives Out sequel. Rian Johnson is a genius at his writing and directing. Should get some Oscar nominations.,5
2022-11-28T20:43:51.000Z,if not we burn down mr. netflix's house,5
2022-11-28T20:45:16.000Z,@DiscussingFilm @irvnstark take your time king https://t.co/zTQ1UHn1LZ,5
2022-11-28T20:44:55.000Z,@DiscussingFilm Take your time king,5
2022-11-28T20:45:20.000Z,Same! 👏👏👏🤘🎬 https://t.co/pSh8TeFl4a,5
